{
  "schema_version": 1,
  "profile_id": "analysis_h264_mp4_27m",
  "profile_version": "0.2.0rc2-2026-08-14",
  "status": "fail",
  "reference_dataset_sha256": "REPLACE_WITH_64_HEX_SHA256",
  "acceptance_criteria": {
    "tracking_median_error_px_max": 1.0,
    "segmentation_iou_min": 0.95,
    "event_f1_min": 0.95
  },
  "metrics": {
    "tracking_median_error_px": null,
    "segmentation_iou": null,
    "event_f1": null
  },
  "evaluated_utc": "REPLACE_WITH_ISO_UTC_TIMESTAMP",
  "notes": "Replace placeholders, set status to pass only after predefined task metrics pass, and keep the evaluated dataset immutable."
}
